{
  "$schema": "https://json-schema.org/draft/2020-12/schema",
  "$id": "https://atrinik.org/schema/supply-chain-inventory-v4.json",
  "title": "Atrinik supply-chain inventory",
  "type": "object",
  "additionalProperties": false,
  "required": ["schema_version", "organization", "created", "license_references", "repositories", "dependencies"],
  "properties": {
    "schema_version": {"const": 4},
    "organization": {"const": "atrinik"},
    "created": {"type": "string", "format": "date-time"},
    "license_references": {
      "type": "object",
      "propertyNames": {"pattern": "^LicenseRef-[A-Za-z0-9.-]+$"},
      "additionalProperties": {"type": "string", "minLength": 1}
    },
    "repositories": {
      "type": "array",
      "minItems": 1,
      "items": {
        "type": "object",
        "additionalProperties": false,
        "required": [
          "name", "repository", "branch", "checkout", "source", "cohorts", "stacks", "roles",
          "license", "commit", "supported", "audit_ready", "audit_mode", "role"
        ],
        "properties": {
          "name": {"type": "string", "pattern": "^[a-z0-9][a-z0-9._-]*$"},
          "repository": {"type": "string", "pattern": "^(?:atrinik/[a-z0-9][a-z0-9._-]*|seraphinastudios/tilewright-(?:editor|renderer))$"},
          "branch": {"type": "string", "minLength": 1},
          "checkout": {"type": "string", "pattern": "^[a-z0-9][a-z0-9._-]*$"},
          "source": {
            "type": "string",
            "pattern": "^(?:\\.|[a-z0-9][a-z0-9._-]*(?:/[a-z0-9][a-z0-9._-]*)*)$"
          },
          "cohorts": {
            "type": "array",
            "uniqueItems": true,
            "items": {"enum": ["classic", "default"]}
          },
          "stacks": {
            "type": "array",
            "uniqueItems": true,
            "items": {"enum": ["classic", "default"]}
          },
          "roles": {
            "type": "array",
            "minItems": 1,
            "uniqueItems": true,
            "items": {"type": "string", "pattern": "^[a-z0-9][a-z0-9._-]*$"}
          },
          "license": {"type": "string", "minLength": 1},
          "commit": {
            "type": ["string", "null"],
            "pattern": "^(?:[0-9a-f]{40}|[0-9a-f]{64})$"
          },
          "supported": {"type": "boolean"},
          "audit_ready": {"type": "boolean"},
          "audit_mode": {"enum": ["full", "metadata"]},
          "role": {"type": "string", "minLength": 1}
        },
        "allOf": [
          {
            "if": {"properties": {"repository": {"const": "seraphinastudios/tilewright-editor"}}},
            "then": {"properties": {"name": {"const": "editor"}, "checkout": {"const": "editor"}}}
          },
          {
            "if": {"properties": {"repository": {"const": "seraphinastudios/tilewright-renderer"}}},
            "then": {"properties": {"name": {"const": "renderer"}, "checkout": {"const": "renderer"}}}
          },
          {
            "if": {"properties": {"supported": {"const": true}}},
            "then": {"properties": {"commit": {"const": null}}}
          }
        ]
      }
    },
    "dependencies": {
      "type": "array",
      "minItems": 1,
      "items": {"$ref": "#/$defs/dependency"}
    }
  },
  "$defs": {
    "evidence": {
      "type": "object",
      "additionalProperties": false,
      "required": ["repository", "path", "contains"],
      "properties": {
        "repository": {"type": "string", "pattern": "^[a-z0-9][a-z0-9._-]*$"},
        "path": {"type": "string", "minLength": 1},
        "contains": {"type": "string", "minLength": 1}
      }
    },
    "dependency": {
      "type": "object",
      "additionalProperties": false,
      "required": [
        "id", "name", "kind", "owner", "scope", "required", "version",
        "version_source", "license", "source_url", "locator", "commit",
        "checksum", "acquisition", "update_cadence_days", "update_mechanism",
        "eol_response", "validation", "disposition", "packages", "evidence"
      ],
      "properties": {
        "id": {"type": "string", "pattern": "^[a-z0-9][a-z0-9._/-]*$"},
        "name": {"type": "string", "minLength": 1},
        "kind": {
          "enum": [
            "container-feature", "container-image", "external-tool",
            "github-action", "language-package-set", "source-archive",
            "system-library", "system-package-set", "toolchain", "vendored-source"
          ]
        },
        "owner": {"type": "string", "pattern": "^[a-z0-9][a-z0-9._-]*$"},
        "scope": {
          "type": "array",
          "minItems": 1,
          "uniqueItems": true,
          "items": {"type": "string", "pattern": "^[a-z0-9][a-z0-9._-]*$"}
        },
        "required": {"type": "boolean"},
        "version": {"type": "string", "minLength": 1},
        "version_source": {"type": "string", "minLength": 1},
        "license": {"type": "string", "minLength": 1},
        "source_url": {"type": "string", "format": "uri", "pattern": "^https://"},
        "locator": {"type": "string", "minLength": 1},
        "commit": {"type": ["string", "null"], "pattern": "^[0-9a-f]{40}$"},
        "checksum": {"type": ["string", "null"], "pattern": "^sha256:[0-9a-f]{64}$"},
        "acquisition": {"type": "string", "minLength": 1},
        "update_cadence_days": {"type": "integer", "minimum": 1, "maximum": 366},
        "update_mechanism": {"type": "string", "minLength": 1},
        "eol_response": {"type": "string", "minLength": 1},
        "validation": {"type": "string", "minLength": 1},
        "disposition": {"enum": ["isolate", "remove", "replace", "retain"]},
        "packages": {
          "type": "array",
          "uniqueItems": true,
          "items": {"type": "string", "minLength": 1}
        },
        "evidence": {
          "type": "array",
          "minItems": 1,
          "items": {"$ref": "#/$defs/evidence"}
        }
      }
    }
  }
}
