{
  "schema_version": 4,
  "organization": "atrinik",
  "created": "2026-08-08T00:00:00Z",
  "license_references": {
    "LicenseRef-Atrinik-Tools-Mixed": "MIT applies by default to tracked files outside narrower notices. GPL-2.0-or-later applies to the complete map-checker-qt/ subtree unless a file explicitly states otherwise."
  },
  "repositories": [
    {
      "audit_ready": true,
      "audit_mode": "full",
      "branch": "main",
      "cohorts": [],
      "license": "MIT",
      "commit": null,
      "name": "atrinik",
      "repository": "atrinik/atrinik",
      "role": "Workspace orchestration and aggregate supply-chain ownership",
      "roles": [
        "workspace"
      ],
      "stacks": [],
      "supported": true,
      "checkout": "atrinik",
      "source": "."
    },
    {
      "audit_ready": true,
      "audit_mode": "metadata",
      "branch": "main",
      "cohorts": [
        "classic"
      ],
      "license": "GPL-2.0-or-later",
      "commit": null,
      "name": "classic",
      "repository": "atrinik/classic",
      "role": "Physical classic checkout governance, CI, dependency, and import-history metadata",
      "roles": [
        "checkout-metadata"
      ],
      "stacks": [
        "classic"
      ],
      "supported": true,
      "checkout": "classic",
      "source": "."
    },
    {
      "audit_ready": true,
      "audit_mode": "full",
      "branch": "main",
      "cohorts": [
        "classic"
      ],
      "license": "GPL-2.0-or-later",
      "commit": null,
      "name": "classic-client",
      "repository": "atrinik/classic",
      "role": "GPL classic SDL3 game client maintained in the classic monorepo",
      "roles": [
        "client"
      ],
      "stacks": [
        "classic"
      ],
      "supported": true,
      "checkout": "classic",
      "source": "client"
    },
    {
      "audit_ready": true,
      "audit_mode": "full",
      "branch": "main",
      "cohorts": [
        "classic"
      ],
      "license": "GPL-2.0-or-later",
      "commit": null,
      "name": "classic-editor",
      "repository": "atrinik/classic",
      "role": "GPL classic Gridarta packaging utility maintained in the classic monorepo",
      "roles": [
        "editor"
      ],
      "stacks": [
        "classic"
      ],
      "supported": true,
      "checkout": "classic",
      "source": "editor"
    },
    {
      "audit_ready": true,
      "audit_mode": "full",
      "branch": "main",
      "cohorts": [
        "classic"
      ],
      "license": "GPL-2.0-or-later",
      "commit": null,
      "name": "classic-libatrinik",
      "repository": "atrinik/classic",
      "role": "GPL classic reusable native libraries maintained in the classic monorepo",
      "roles": [
        "libatrinik"
      ],
      "stacks": [
        "classic"
      ],
      "supported": true,
      "checkout": "classic",
      "source": "libatrinik"
    },
    {
      "audit_ready": true,
      "audit_mode": "full",
      "branch": "main",
      "cohorts": [
        "classic"
      ],
      "license": "GPL-2.0-or-later",
      "commit": null,
      "name": "classic-protocol",
      "repository": "atrinik/classic",
      "role": "GPL classic C protocol schemas and generated bindings maintained in the classic monorepo",
      "roles": [
        "protocol"
      ],
      "stacks": [
        "classic"
      ],
      "supported": true,
      "checkout": "classic",
      "source": "protocol"
    },
    {
      "audit_ready": true,
      "audit_mode": "full",
      "branch": "main",
      "cohorts": [
        "classic"
      ],
      "license": "GPL-2.0-or-later",
      "commit": null,
      "name": "classic-server",
      "repository": "atrinik/classic",
      "role": "GPL classic authoritative game server maintained in the classic monorepo",
      "roles": [
        "server"
      ],
      "stacks": [
        "classic"
      ],
      "supported": true,
      "checkout": "classic",
      "source": "server"
    },
    {
      "audit_ready": true,
      "audit_mode": "full",
      "branch": "main",
      "cohorts": [
        "default"
      ],
      "license": "MIT",
      "commit": null,
      "name": "client",
      "repository": "atrinik/client",
      "role": "MIT Rust game client replacement with an independently validated M1 foundation",
      "roles": [
        "client"
      ],
      "stacks": [
        "default"
      ],
      "supported": true,
      "checkout": "client",
      "source": "."
    },
    {
      "audit_ready": true,
      "audit_mode": "full",
      "branch": "main",
      "cohorts": [
        "default"
      ],
      "license": "LicenseRef-Atrinik-Content",
      "commit": null,
      "name": "content",
      "repository": "atrinik/content",
      "role": "Authored world content and content tooling",
      "roles": [
        "content"
      ],
      "stacks": [
        "classic",
        "default"
      ],
      "supported": true,
      "checkout": "content",
      "source": "."
    },
    {
      "audit_ready": true,
      "audit_mode": "full",
      "branch": "main",
      "cohorts": [
        "default"
      ],
      "license": "MIT",
      "commit": null,
      "name": "content-toolkit",
      "repository": "atrinik/content-toolkit",
      "role": "MIT content model, compiler, validator, and migration toolkit with an independently validated M1 foundation",
      "roles": [
        "content-toolkit"
      ],
      "stacks": [
        "default"
      ],
      "supported": true,
      "checkout": "content-toolkit",
      "source": "."
    },
    {
      "audit_ready": true,
      "audit_mode": "full",
      "branch": "main",
      "cohorts": [
        "default"
      ],
      "license": "MIT",
      "commit": null,
      "name": "deploy-control",
      "repository": "atrinik/deploy-control",
      "role": "Cloudflare control plane and registered host-agent infrastructure",
      "roles": [
        "deploy-control"
      ],
      "stacks": [
        "default"
      ],
      "supported": true,
      "checkout": "deploy-control",
      "source": "."
    },
    {
      "audit_ready": true,
      "audit_mode": "full",
      "branch": "main",
      "cohorts": [
        "default"
      ],
      "license": "MIT",
      "commit": null,
      "name": "devcontainer",
      "repository": "atrinik/devcontainer",
      "role": "Linux and Windows build images",
      "roles": [
        "devcontainer"
      ],
      "stacks": [
        "classic",
        "default"
      ],
      "supported": true,
      "checkout": "devcontainer",
      "source": "."
    },
    {
      "audit_ready": true,
      "audit_mode": "full",
      "branch": "main",
      "cohorts": [
        "default"
      ],
      "license": "MIT",
      "commit": null,
      "name": "editor",
      "repository": "atrinik/editor",
      "role": "MIT Rust content editor replacement with an independently validated M1 foundation",
      "roles": [
        "editor"
      ],
      "stacks": [
        "default"
      ],
      "supported": true,
      "checkout": "editor",
      "source": "."
    },
    {
      "audit_ready": true,
      "audit_mode": "full",
      "branch": "main",
      "cohorts": [
        "default"
      ],
      "license": "MIT",
      "commit": null,
      "name": "github-settings",
      "repository": "atrinik/github-settings",
      "role": "Organization governance desired state",
      "roles": [
        "github-settings"
      ],
      "stacks": [
        "classic",
        "default"
      ],
      "supported": true,
      "checkout": "github-settings",
      "source": "."
    },
    {
      "audit_ready": true,
      "audit_mode": "full",
      "branch": "main",
      "cohorts": [
        "default"
      ],
      "license": "MIT",
      "commit": null,
      "name": "metaserver-worker",
      "repository": "atrinik/metaserver-worker",
      "role": "Cloudflare metaserver and rendezvous Worker",
      "roles": [
        "metaserver-worker"
      ],
      "stacks": [
        "classic",
        "default"
      ],
      "supported": true,
      "checkout": "metaserver-worker",
      "source": "."
    },
    {
      "audit_ready": true,
      "audit_mode": "full",
      "branch": "main",
      "cohorts": [],
      "license": "NOASSERTION",
      "commit": null,
      "name": "nawerhals",
      "repository": "atrinik/nawerhals",
      "role": "Archived historical source; no supported build or update surface",
      "roles": [
        "archive"
      ],
      "stacks": [],
      "supported": false,
      "checkout": "nawerhals",
      "source": "."
    },
    {
      "audit_ready": true,
      "audit_mode": "full",
      "branch": "main",
      "cohorts": [
        "default"
      ],
      "license": "MIT",
      "commit": null,
      "name": "observatory",
      "repository": "atrinik/observatory",
      "role": "Read-only build, release, package, deployment, and public-service status dashboard",
      "roles": [
        "observatory"
      ],
      "stacks": [
        "default"
      ],
      "supported": true,
      "checkout": "observatory",
      "source": "."
    },
    {
      "audit_ready": false,
      "audit_mode": "full",
      "branch": "main",
      "cohorts": [
        "default"
      ],
      "license": "MIT",
      "commit": null,
      "name": "pathfinder",
      "repository": "atrinik/pathfinder",
      "role": "Pathfinding and waypoint navigation service over the authored content",
      "roles": [
        "pathfinder"
      ],
      "stacks": [
        "classic",
        "default"
      ],
      "supported": true,
      "checkout": "pathfinder",
      "source": "."
    },
    {
      "audit_ready": true,
      "audit_mode": "full",
      "branch": "main",
      "cohorts": [
        "classic"
      ],
      "license": "MIT",
      "commit": null,
      "name": "playtester",
      "repository": "atrinik/playtester",
      "role": "MIT autonomous end-to-end playtester for the classic game",
      "roles": [